smartctl 7.4 2023-08-01 r5530 [x86_64-linux-6.12.74+deb13+1-amd64] (local build)
Copyright (C) 2002-23, Bruce Allen, Christian Franke, www.smartmontools.org

=== START OF INFORMATION SECTION ===
Model Family:     Seagate Barracuda 7200.14 (AF)
Device Model:     ST500DM002-1BD142
Serial Number:    W3TQFS8T
LU WWN Device Id: 5 000c50 09b391ba1
Firmware Version: KC67
User Capacity:    500,107,862,016 bytes [500 GB]
Sector Sizes:     512 bytes logical, 4096 bytes physical
Rotation Rate:    7200 rpm
Device is:        In smartctl database 7.3/5528
ATA Version is:   ATA8-ACS T13/1699-D revision 4
SATA Version is:  SATA 3.0, 6.0 Gb/s (current: 6.0 Gb/s)
Local Time is:    Sat Apr  4 05:15:25 2026 BST
SMART support is: Available - device has SMART capability.
SMART support is: Enabled

=== START OF READ SMART DATA SECTION ===
SMART overall-health self-assessment test result: PASSED

General SMART Values:
Offline data collection status:  (0x82)	Offline data collection activity
					was completed without error.
					Auto Offline Data Collection: Enabled.
Self-test execution status:      (   0)	The previous self-test routine completed
					without error or no self-test has ever 
					been run.
Total time to complete Offline 
data collection: 		(  609) seconds.
Offline data collection
capabilities: 			 (0x7b) SMART execute Offline immediate.
					Auto Offline data collection on/off support.
					Suspend Offline collection upon new
					command.
					Offline surface scan supported.
					Self-test supported.
					Conveyance Self-test supported.
					Selective Self-test supported.
SMART capabilities:            (0x0003)	Saves SMART data before entering
					power-saving mode.
					Supports SMART auto save timer.
Error logging capability:        (0x01)	Error logging supported.
					General Purpose Logging supported.
Short self-test routine 
recommended polling time: 	 (   1) minutes.
Extended self-test routine
recommended polling time: 	 (  85) minutes.
Conveyance self-test routine
recommended polling time: 	 (   2) minutes.
SCT capabilities: 	       (0x303f)	SCT Status supported.
					SCT Error Recovery Control supported.
					SCT Feature Control supported.
					SCT Data Table supported.

SMART Attributes Data Structure revision number: 10
Vendor Specific SMART Attributes with Thresholds:
ID# ATTRIBUTE_NAME          FLAG     VALUE WORST THRESH TYPE      UPDATED  WHEN_FAILED RAW_VALUE
  1 Raw_Read_Error_Rate     0x000f   116   099   006    Pre-fail  Always       -       102769680
  3 Spin_Up_Time            0x0003   100   100   000    Pre-fail  Always       -       0
  4 Start_Stop_Count        0x0032   095   095   020    Old_age   Always       -       5454
  5 Reallocated_Sector_Ct   0x0033   100   100   036    Pre-fail  Always       -       0
  7 Seek_Error_Rate         0x000f   075   060   030    Pre-fail  Always       -       30340074611
  9 Power_On_Hours          0x0032   092   092   000    Old_age   Always       -       7253
 10 Spin_Retry_Count        0x0013   100   100   097    Pre-fail  Always       -       0
 12 Power_Cycle_Count       0x0032   100   100   020    Old_age   Always       -       982
183 Runtime_Bad_Block       0x0032   100   100   000    Old_age   Always       -       0
184 End-to-End_Error        0x0032   100   100   099    Old_age   Always       -       0
187 Reported_Uncorrect      0x0032   065   065   000    Old_age   Always       -       35
188 Command_Timeout         0x0032   100   100   000    Old_age   Always       -       0 0 2
189 High_Fly_Writes         0x003a   100   100   000    Old_age   Always       -       0
190 Airflow_Temperature_Cel 0x0022   061   048   045    Old_age   Always       -       39 (Min/Max 16/41)
194 Temperature_Celsius     0x0022   039   052   000    Old_age   Always       -       39 (0 11 0 0 0)
195 Hardware_ECC_Recovered  0x001a   047   040   000    Old_age   Always       -       102769680
197 Current_Pending_Sector  0x0012   100   100   000    Old_age   Always       -       0
198 Offline_Uncorrectable   0x0010   100   100   000    Old_age   Offline      -       0
199 UDMA_CRC_Error_Count    0x003e   200   200   000    Old_age   Always       -       0
240 Head_Flying_Hours       0x0000   100   253   000    Old_age   Offline      -       7211h+19m+07.475s
241 Total_LBAs_Written      0x0000   100   253   000    Old_age   Offline      -       129106800076457
242 Total_LBAs_Read         0x0000   100   253   000    Old_age   Offline      -       48184210623388

SMART Error Log Version: 1
No Errors Logged

SMART Self-test log structure revision number 1
Num  Test_Description    Status                  Remaining  LifeTime(hours)  LBA_of_first_error
# 1  Extended offline    Completed without error       00%      6565         -
# 2  Short offline       Completed without error       00%      6563         -
# 3  Extended offline    Completed without error       00%      5795         -
# 4  Short offline       Completed without error       00%      5764         -
# 5  Vendor (0x50)       Completed without error       00%      5704         -
# 6  Short offline       Aborted by host               90%      5704         -
# 7  Vendor (0x50)       Completed without error       00%      5631         -
# 8  Short offline       Completed without error       00%      5631         -
# 9  Vendor (0x50)       Completed without error       00%      5403         -
#10  Short offline       Completed without error       00%      5403         -
#11  Vendor (0x50)       Completed without error       00%      5088         -
#12  Short offline       Completed without error       00%      5087         -
#13  Vendor (0x50)       Completed without error       00%      4889         -
#14  Short offline       Completed without error       00%      4889         -
#15  Vendor (0x50)       Completed without error       00%      3619         -
#16  Short offline       Completed without error       00%      3619         -
#17  Vendor (0x50)       Completed without error       00%      3012         -
#18  Short offline       Completed without error       00%      3012         -
#19  Vendor (0x50)       Completed without error       00%      2774         -
#20  Short offline       Completed without error       00%      2774         -
#21  Short offline       Aborted by host               10%      2608         -

SMART Selective self-test log data structure revision number 1
 SPAN  MIN_LBA  MAX_LBA  CURRENT_TEST_STATUS
    1        0        0  Not_testing
    2        0        0  Not_testing
    3        0        0  Not_testing
    4        0        0  Not_testing
    5        0        0  Not_testing
Selective self-test flags (0x0):
  After scanning selected spans, do NOT read-scan remainder of disk.
If Selective self-test is pending on power-up, resume after 0 minute delay.

The above only provides legacy SMART information - try 'smartctl -x' for more

