smartctl 7.4 2023-08-01 r5530 [x86_64-linux-6.12.74+deb13+1-amd64] (local build)
Copyright (C) 2002-23, Bruce Allen, Christian Franke, www.smartmontools.org

=== START OF INFORMATION SECTION ===
Model Family:     Seagate Pipeline HD 5900.2
Device Model:     ST3500312CS
Serial Number:    5VVRKGAV
LU WWN Device Id: 5 000c50 07817d836
Firmware Version: CA12
User Capacity:    500,107,862,016 bytes [500 GB]
Sector Size:      512 bytes logical/physical
Rotation Rate:    5900 rpm
Device is:        In smartctl database 7.3/5528
ATA Version is:   ATA8-ACS T13/1699-D revision 4
SATA Version is:  SATA 2.6, 3.0 Gb/s (current: 3.0 Gb/s)
Local Time is:    Sat Apr  4 04:54:02 2026 BST
SMART support is: Available - device has SMART capability.
SMART support is: Enabled

=== START OF READ SMART DATA SECTION ===
SMART overall-health self-assessment test result: PASSED
See vendor-specific Attribute list for marginal Attributes.

General SMART Values:
Offline data collection status:  (0x00)	Offline data collection activity
					was never started.
					Auto Offline Data Collection: Disabled.
Self-test execution status:      (   0)	The previous self-test routine completed
					without error or no self-test has ever 
					been run.
Total time to complete Offline 
data collection: 		(  633) seconds.
Offline data collection
capabilities: 			 (0x73) SMART execute Offline immediate.
					Auto Offline data collection on/off support.
					Suspend Offline collection upon new
					command.
					No Offline surface scan supported.
					Self-test supported.
					Conveyance Self-test supported.
					Selective Self-test supported.
SMART capabilities:            (0x0003)	Saves SMART data before entering
					power-saving mode.
					Supports SMART auto save timer.
Error logging capability:        (0x01)	Error logging supported.
					General Purpose Logging supported.
Short self-test routine 
recommended polling time: 	 (   1) minutes.
Extended self-test routine
recommended polling time: 	 ( 110) minutes.
Conveyance self-test routine
recommended polling time: 	 (   2) minutes.
SCT capabilities: 	       (0x103b)	SCT Status supported.
					SCT Error Recovery Control supported.
					SCT Feature Control supported.
					SCT Data Table supported.

SMART Attributes Data Structure revision number: 10
Vendor Specific SMART Attributes with Thresholds:
ID# ATTRIBUTE_NAME          FLAG     VALUE WORST THRESH TYPE      UPDATED  WHEN_FAILED RAW_VALUE
  1 Raw_Read_Error_Rate     0x000f   119   099   006    Pre-fail  Always       -       226221585
  3 Spin_Up_Time            0x0003   097   097   000    Pre-fail  Always       -       0
  4 Start_Stop_Count        0x0032   037   037   020    Old_age   Always       -       65535
  5 Reallocated_Sector_Ct   0x0033   100   100   036    Pre-fail  Always       -       0
  7 Seek_Error_Rate         0x000f   084   060   030    Pre-fail  Always       -       309313690
  9 Power_On_Hours          0x0032   057   057   000    Old_age   Always       -       37899
 10 Spin_Retry_Count        0x0013   100   100   097    Pre-fail  Always       -       0
 12 Power_Cycle_Count       0x0032   100   100   020    Old_age   Always       -       199
184 End-to-End_Error        0x0032   100   100   099    Old_age   Always       -       0
187 Reported_Uncorrect      0x0032   100   100   000    Old_age   Always       -       0
188 Command_Timeout         0x0032   100   099   000    Old_age   Always       -       12885098499
189 High_Fly_Writes         0x003a   100   100   000    Old_age   Always       -       0
190 Airflow_Temperature_Cel 0x0022   068   041   045    Old_age   Always   In_the_past 32 (1 139 34 17 0)
194 Temperature_Celsius     0x0022   032   059   000    Old_age   Always       -       32 (0 13 0 0 0)
195 Hardware_ECC_Recovered  0x001a   057   037   000    Old_age   Always       -       226221585
197 Current_Pending_Sector  0x0012   100   100   000    Old_age   Always       -       0
198 Offline_Uncorrectable   0x0010   100   100   000    Old_age   Offline      -       0
199 UDMA_CRC_Error_Count    0x003e   200   200   000    Old_age   Always       -       0

SMART Error Log Version: 1
No Errors Logged

SMART Self-test log structure revision number 1
Num  Test_Description    Status                  Remaining  LifeTime(hours)  LBA_of_first_error
# 1  Extended offline    Completed without error       00%     37204         -
# 2  Extended offline    Completed without error       00%     37105         -
# 3  Short offline       Completed without error       00%     37103         -
# 4  Short offline       Aborted by host               90%     37103         -
# 5  Short offline       Aborted by host               90%     37103         -
# 6  Short offline       Aborted by host               90%     37103         -
# 7  Short offline       Aborted by host               90%     37103         -
# 8  Short offline       Aborted by host               90%     37103         -
# 9  Short offline       Aborted by host               90%     37103         -
#10  Short offline       Aborted by host               90%     37103         -
#11  Short offline       Aborted by host               90%     37103         -
#12  Short offline       Aborted by host               90%     37103         -
#13  Short offline       Aborted by host               90%     37103         -
#14  Short offline       Aborted by host               90%     37103         -
#15  Short offline       Aborted by host               90%     37103         -
#16  Short offline       Aborted by host               90%     37103         -
#17  Short offline       Aborted by host               90%     37103         -
#18  Short offline       Aborted by host               70%     37103         -
#19  Short offline       Aborted by host               90%     37103         -
#20  Short offline       Aborted by host               90%     37103         -
#21  Short offline       Aborted by host               90%     37103         -

SMART Selective self-test log data structure revision number 1
 SPAN  MIN_LBA  MAX_LBA  CURRENT_TEST_STATUS
    1        0        0  Not_testing
    2        0        0  Not_testing
    3        0        0  Not_testing
    4        0        0  Not_testing
    5        0        0  Not_testing
Selective self-test flags (0x0):
  After scanning selected spans, do NOT read-scan remainder of disk.
If Selective self-test is pending on power-up, resume after 0 minute delay.

The above only provides legacy SMART information - try 'smartctl -x' for more

