smartctl 7.4 2023-08-01 r5530 [x86_64-linux-6.12.74+deb13+1-amd64] (local build)
Copyright (C) 2002-23, Bruce Allen, Christian Franke, www.smartmontools.org

=== START OF INFORMATION SECTION ===
Model Family:     Seagate Barracuda 7200.12
Device Model:     ST3500418AS
Serial Number:    Z2ACPF1Z
LU WWN Device Id: 5 000c50 0364b5178
Firmware Version: AP2A
User Capacity:    500,107,862,016 bytes [500 GB]
Sector Size:      512 bytes logical/physical
Rotation Rate:    7200 rpm
Device is:        In smartctl database 7.3/5528
ATA Version is:   ATA8-ACS T13/1699-D revision 4
SATA Version is:  SATA 2.6, 3.0 Gb/s
Local Time is:    Wed Apr  1 17:27:17 2026 BST

==> WARNING: A firmware update for this drive may be available,
see the following Seagate web pages:
http://knowledge.seagate.com/articles/en_US/FAQ/207931en
http://knowledge.seagate.com/articles/en_US/FAQ/213891en

SMART support is: Available - device has SMART capability.
SMART support is: Enabled

=== START OF READ SMART DATA SECTION ===
SMART overall-health self-assessment test result: PASSED
See vendor-specific Attribute list for marginal Attributes.

General SMART Values:
Offline data collection status:  (0x82)	Offline data collection activity
					was completed without error.
					Auto Offline Data Collection: Enabled.
Self-test execution status:      (   0)	The previous self-test routine completed
					without error or no self-test has ever 
					been run.
Total time to complete Offline 
data collection: 		(  600) seconds.
Offline data collection
capabilities: 			 (0x7b) SMART execute Offline immediate.
					Auto Offline data collection on/off support.
					Suspend Offline collection upon new
					command.
					Offline surface scan supported.
					Self-test supported.
					Conveyance Self-test supported.
					Selective Self-test supported.
SMART capabilities:            (0x0003)	Saves SMART data before entering
					power-saving mode.
					Supports SMART auto save timer.
Error logging capability:        (0x01)	Error logging supported.
					General Purpose Logging supported.
Short self-test routine 
recommended polling time: 	 (   1) minutes.
Extended self-test routine
recommended polling time: 	 (  85) minutes.
Conveyance self-test routine
recommended polling time: 	 (   2) minutes.
SCT capabilities: 	       (0x103f)	SCT Status supported.
					SCT Error Recovery Control supported.
					SCT Feature Control supported.
					SCT Data Table supported.

SMART Attributes Data Structure revision number: 10
Vendor Specific SMART Attributes with Thresholds:
ID# ATTRIBUTE_NAME          FLAG     VALUE WORST THRESH TYPE      UPDATED  WHEN_FAILED RAW_VALUE
  1 Raw_Read_Error_Rate     0x000e   119   099   006    Old_age   Always       -       211589322
  3 Spin_Up_Time            0x0003   100   100   000    Pre-fail  Always       -       0
  4 Start_Stop_Count        0x0032   091   091   020    Old_age   Always       -       9359
  5 Reallocated_Sector_Ct   0x0033   100   100   036    Pre-fail  Always       -       0
  7 Seek_Error_Rate         0x000f   082   060   030    Pre-fail  Always       -       188267611
  9 Power_On_Hours          0x0032   087   087   000    Old_age   Always       -       12224
 10 Spin_Retry_Count        0x0013   100   100   097    Pre-fail  Always       -       0
 12 Power_Cycle_Count       0x0032   092   092   020    Old_age   Always       -       8769
184 End-to-End_Error        0x0032   100   100   099    Old_age   Always       -       0
187 Reported_Uncorrect      0x0032   094   094   000    Old_age   Always       -       6
188 Command_Timeout         0x0032   100   099   000    Old_age   Always       -       29
189 High_Fly_Writes         0x003a   100   100   000    Old_age   Always       -       0
190 Airflow_Temperature_Cel 0x0022   062   042   045    Old_age   Always   In_the_past 38 (0 23 39 17 0)
194 Temperature_Celsius     0x0022   038   058   000    Old_age   Always       -       38 (0 9 0 0 0)
195 Hardware_ECC_Recovered  0x001a   029   024   000    Old_age   Always       -       211589322
197 Current_Pending_Sector  0x0012   100   100   000    Old_age   Always       -       0
198 Offline_Uncorrectable   0x0010   100   100   000    Old_age   Offline      -       0
199 UDMA_CRC_Error_Count    0x003e   200   200   000    Old_age   Always       -       0

SMART Error Log Version: 1
ATA Error Count: 6 (device log contains only the most recent five errors)
	CR = Command Register [HEX]
	FR = Features Register [HEX]
	SC = Sector Count Register [HEX]
	SN = Sector Number Register [HEX]
	CL = Cylinder Low Register [HEX]
	CH = Cylinder High Register [HEX]
	DH = Device/Head Register [HEX]
	DC = Device Command Register [HEX]
	ER = Error register [HEX]
	ST = Status register [HEX]
Powered_Up_Time is measured from power on, and printed as
DDd+hh:mm:SS.sss where DD=days, hh=hours, mm=minutes,
SS=sec, and sss=millisec. It "wraps" after 49.710 days.

Error 6 occurred at disk power-on lifetime: 11503 hours (479 days + 7 hours)
  When the command that caused the error occurred, the device was active or idle.

  After command completion occurred, registers were:
  ER ST SC SN CL CH DH
  -- -- -- -- -- -- --
  40 51 00 ff ff ff 0f  Error: UNC at LBA = 0x0fffffff = 268435455

  Commands leading to the command that caused the error were:
  CR FR SC SN CL CH DH DC   Powered_Up_Time  Command/Feature_Name
  -- -- -- -- -- -- -- --  ----------------  --------------------
  60 00 08 ff ff ff 4f 00      06:16:09.682  READ FPDMA QUEUED
  27 00 00 00 00 00 e0 00      06:16:09.681  READ NATIVE MAX ADDRESS EXT [OBS-ACS-3]
  ec 00 00 00 00 00 a0 00      06:16:09.680  IDENTIFY DEVICE
  ef 03 46 00 00 00 a0 00      06:16:09.680  SET FEATURES [Set transfer mode]
  27 00 00 00 00 00 e0 00      06:16:09.680  READ NATIVE MAX ADDRESS EXT [OBS-ACS-3]

Error 5 occurred at disk power-on lifetime: 11503 hours (479 days + 7 hours)
  When the command that caused the error occurred, the device was active or idle.

  After command completion occurred, registers were:
  ER ST SC SN CL CH DH
  -- -- -- -- -- -- --
  40 51 00 ff ff ff 0f  Error: UNC at LBA = 0x0fffffff = 268435455

  Commands leading to the command that caused the error were:
  CR FR SC SN CL CH DH DC   Powered_Up_Time  Command/Feature_Name
  -- -- -- -- -- -- -- --  ----------------  --------------------
  60 00 08 ff ff ff 4f 00      06:16:06.792  READ FPDMA QUEUED
  27 00 00 00 00 00 e0 00      06:16:06.791  READ NATIVE MAX ADDRESS EXT [OBS-ACS-3]
  ec 00 00 00 00 00 a0 00      06:16:06.790  IDENTIFY DEVICE
  ef 03 46 00 00 00 a0 00      06:16:06.790  SET FEATURES [Set transfer mode]
  27 00 00 00 00 00 e0 00      06:16:06.771  READ NATIVE MAX ADDRESS EXT [OBS-ACS-3]

Error 4 occurred at disk power-on lifetime: 11503 hours (479 days + 7 hours)
  When the command that caused the error occurred, the device was active or idle.

  After command completion occurred, registers were:
  ER ST SC SN CL CH DH
  -- -- -- -- -- -- --
  40 51 00 ff ff ff 0f  Error: UNC at LBA = 0x0fffffff = 268435455

  Commands leading to the command that caused the error were:
  CR FR SC SN CL CH DH DC   Powered_Up_Time  Command/Feature_Name
  -- -- -- -- -- -- -- --  ----------------  --------------------
  60 00 08 ff ff ff 4f 00      06:16:03.979  READ FPDMA QUEUED
  27 00 00 00 00 00 e0 00      06:16:03.978  READ NATIVE MAX ADDRESS EXT [OBS-ACS-3]
  ec 00 00 00 00 00 a0 00      06:16:03.977  IDENTIFY DEVICE
  ef 03 46 00 00 00 a0 00      06:16:03.977  SET FEATURES [Set transfer mode]
  27 00 00 00 00 00 e0 00      06:16:03.977  READ NATIVE MAX ADDRESS EXT [OBS-ACS-3]

Error 3 occurred at disk power-on lifetime: 11503 hours (479 days + 7 hours)
  When the command that caused the error occurred, the device was active or idle.

  After command completion occurred, registers were:
  ER ST SC SN CL CH DH
  -- -- -- -- -- -- --
  40 51 00 ff ff ff 0f  Error: UNC at LBA = 0x0fffffff = 268435455

  Commands leading to the command that caused the error were:
  CR FR SC SN CL CH DH DC   Powered_Up_Time  Command/Feature_Name
  -- -- -- -- -- -- -- --  ----------------  --------------------
  60 00 08 ff ff ff 4f 00      06:16:01.110  READ FPDMA QUEUED
  60 00 08 ff ff ff 4f 00      06:16:01.089  READ FPDMA QUEUED
  60 00 80 ff ff ff 4f 00      06:16:01.089  READ FPDMA QUEUED
  27 00 00 00 00 00 e0 00      06:16:01.088  READ NATIVE MAX ADDRESS EXT [OBS-ACS-3]
  ec 00 00 00 00 00 a0 00      06:16:01.087  IDENTIFY DEVICE

Error 2 occurred at disk power-on lifetime: 11503 hours (479 days + 7 hours)
  When the command that caused the error occurred, the device was active or idle.

  After command completion occurred, registers were:
  ER ST SC SN CL CH DH
  -- -- -- -- -- -- --
  40 51 00 ff ff ff 0f  Error: UNC at LBA = 0x0fffffff = 268435455

  Commands leading to the command that caused the error were:
  CR FR SC SN CL CH DH DC   Powered_Up_Time  Command/Feature_Name
  -- -- -- -- -- -- -- --  ----------------  --------------------
  60 00 80 ff ff ff 4f 00      06:15:58.172  READ FPDMA QUEUED
  60 00 40 ff ff ff 4f 00      06:15:58.171  READ FPDMA QUEUED
  60 00 20 ff ff ff 4f 00      06:15:58.143  READ FPDMA QUEUED
  60 00 08 ff ff ff 4f 00      06:15:58.116  READ FPDMA QUEUED
  27 00 00 00 00 00 e0 00      06:15:58.116  READ NATIVE MAX ADDRESS EXT [OBS-ACS-3]

SMART Self-test log structure revision number 1
Num  Test_Description    Status                  Remaining  LifeTime(hours)  LBA_of_first_error
# 1  Extended offline    Completed: read failure       20%     11498         779433788
# 2  Short offline       Completed without error       00%     11497         -
# 3  Extended offline    Completed: read failure       20%     11301         779433788
# 4  Short offline       Completed without error       00%     11298         -

SMART Selective self-test log data structure revision number 1
 SPAN  MIN_LBA  MAX_LBA  CURRENT_TEST_STATUS
    1        0        0  Not_testing
    2        0        0  Not_testing
    3        0        0  Not_testing
    4        0        0  Not_testing
    5        0        0  Not_testing
Selective self-test flags (0x0):
  After scanning selected spans, do NOT read-scan remainder of disk.
If Selective self-test is pending on power-up, resume after 0 minute delay.

The above only provides legacy SMART information - try 'smartctl -x' for more

