smartctl 7.4 2023-08-01 r5530 [x86_64-linux-6.12.74+deb13+1-amd64] (local build)
Copyright (C) 2002-23, Bruce Allen, Christian Franke, www.smartmontools.org

=== START OF INFORMATION SECTION ===
Model Family:     Seagate Barracuda 7200.14 (AF)
Device Model:     ST500DM002-1BD142
Serial Number:    W3TQ01LD
LU WWN Device Id: 5 000c50 09a940454
Firmware Version: KC67
User Capacity:    500,107,862,016 bytes [500 GB]
Sector Sizes:     512 bytes logical, 4096 bytes physical
Rotation Rate:    7200 rpm
Device is:        In smartctl database 7.3/5528
ATA Version is:   ATA8-ACS T13/1699-D revision 4
SATA Version is:  SATA 3.0, 6.0 Gb/s (current: 6.0 Gb/s)
Local Time is:    Wed Apr  1 17:27:18 2026 BST
SMART support is: Available - device has SMART capability.
SMART support is: Enabled

=== START OF READ SMART DATA SECTION ===
SMART overall-health self-assessment test result: PASSED
See vendor-specific Attribute list for marginal Attributes.

General SMART Values:
Offline data collection status:  (0x82)	Offline data collection activity
					was completed without error.
					Auto Offline Data Collection: Enabled.
Self-test execution status:      (   0)	The previous self-test routine completed
					without error or no self-test has ever 
					been run.
Total time to complete Offline 
data collection: 		(  600) seconds.
Offline data collection
capabilities: 			 (0x7b) SMART execute Offline immediate.
					Auto Offline data collection on/off support.
					Suspend Offline collection upon new
					command.
					Offline surface scan supported.
					Self-test supported.
					Conveyance Self-test supported.
					Selective Self-test supported.
SMART capabilities:            (0x0003)	Saves SMART data before entering
					power-saving mode.
					Supports SMART auto save timer.
Error logging capability:        (0x01)	Error logging supported.
					General Purpose Logging supported.
Short self-test routine 
recommended polling time: 	 (   1) minutes.
Extended self-test routine
recommended polling time: 	 (  84) minutes.
Conveyance self-test routine
recommended polling time: 	 (   2) minutes.
SCT capabilities: 	       (0x303f)	SCT Status supported.
					SCT Error Recovery Control supported.
					SCT Feature Control supported.
					SCT Data Table supported.

SMART Attributes Data Structure revision number: 10
Vendor Specific SMART Attributes with Thresholds:
ID# ATTRIBUTE_NAME          FLAG     VALUE WORST THRESH TYPE      UPDATED  WHEN_FAILED RAW_VALUE
  1 Raw_Read_Error_Rate     0x000f   118   099   006    Pre-fail  Always       -       189970752
  3 Spin_Up_Time            0x0003   100   100   000    Pre-fail  Always       -       0
  4 Start_Stop_Count        0x0032   086   086   020    Old_age   Always       -       14343
  5 Reallocated_Sector_Ct   0x0033   100   100   036    Pre-fail  Always       -       0
  7 Seek_Error_Rate         0x000f   079   060   030    Pre-fail  Always       -       26276203966
  9 Power_On_Hours          0x0032   083   083   000    Old_age   Always       -       15702
 10 Spin_Retry_Count        0x0013   100   100   097    Pre-fail  Always       -       0
 12 Power_Cycle_Count       0x0032   087   087   020    Old_age   Always       -       14182
183 Runtime_Bad_Block       0x0032   099   099   000    Old_age   Always       -       1
184 End-to-End_Error        0x0032   100   100   099    Old_age   Always       -       0
187 Reported_Uncorrect      0x0032   098   098   000    Old_age   Always       -       2
188 Command_Timeout         0x0032   100   100   000    Old_age   Always       -       0 0 0
189 High_Fly_Writes         0x003a   100   100   000    Old_age   Always       -       0
190 Airflow_Temperature_Cel 0x0022   059   042   045    Old_age   Always   In_the_past 41 (Min/Max 17/42 #18)
194 Temperature_Celsius     0x0022   041   058   000    Old_age   Always       -       41 (0 7 0 0 0)
195 Hardware_ECC_Recovered  0x001a   040   038   000    Old_age   Always       -       189970752
197 Current_Pending_Sector  0x0012   100   100   000    Old_age   Always       -       0
198 Offline_Uncorrectable   0x0010   100   100   000    Old_age   Offline      -       0
199 UDMA_CRC_Error_Count    0x003e   200   200   000    Old_age   Always       -       0
240 Head_Flying_Hours       0x0000   100   253   000    Old_age   Offline      -       15731h+38m+50.621s
241 Total_LBAs_Written      0x0000   100   253   000    Old_age   Offline      -       210407071002749
242 Total_LBAs_Read         0x0000   100   253   000    Old_age   Offline      -       123919024881241

SMART Error Log Version: 1
No Errors Logged

SMART Self-test log structure revision number 1
Num  Test_Description    Status                  Remaining  LifeTime(hours)  LBA_of_first_error
# 1  Extended offline    Completed without error       00%     14970         -
# 2  Short offline       Completed without error       00%     14969         -
# 3  Short offline       Completed without error       00%     14969         -
# 4  Short offline       Aborted by host               90%     14969         -
# 5  Short offline       Aborted by host               90%     14969         -
# 6  Short offline       Aborted by host               90%     14969         -
# 7  Short offline       Completed without error       00%     14968         -
# 8  Short offline       Aborted by host               90%     14968         -
# 9  Short offline       Aborted by host               90%     14968         -
#10  Short offline       Aborted by host               90%     14968         -
#11  Short offline       Aborted by host               90%     14968         -
#12  Short offline       Aborted by host               90%     14968         -
#13  Extended offline    Completed without error       00%     14962         -
#14  Extended offline    Completed without error       00%     14961         -
#15  Short offline       Completed without error       00%     14960         -
#16  Extended offline    Completed without error       00%     14699         -
#17  Extended offline    Completed without error       00%     14675         -
#18  Short offline       Completed without error       00%     14671         -
#19  Vendor (0x50)       Completed without error       00%     14505         -
#20  Short offline       Completed without error       00%     14505         -
#21  Vendor (0x50)       Completed without error       00%     13910         -

SMART Selective self-test log data structure revision number 1
 SPAN  MIN_LBA  MAX_LBA  CURRENT_TEST_STATUS
    1        0        0  Not_testing
    2        0        0  Not_testing
    3        0        0  Not_testing
    4        0        0  Not_testing
    5        0        0  Not_testing
Selective self-test flags (0x0):
  After scanning selected spans, do NOT read-scan remainder of disk.
If Selective self-test is pending on power-up, resume after 0 minute delay.

The above only provides legacy SMART information - try 'smartctl -x' for more

